English,Japanese
"Hello, how are you today?","こんにちは、今日はご機嫌いかがですか？"
"The quick brown fox jumps over the lazy dog.","素早い茶色の狐が、怠け者の犬を飛び越えます。"
"Artificial intelligence is transforming the way we work and live.","人工知能は私たちの働き方や生活を変えつつあります。"
"Learning a new language opens up a world of opportunities.","新しい言語を学ぶことは、チャンスの世界を広げてくれます。"
"Consistent practice is the key to mastering any skill.","継続的な練習が、どんなスキルを習得するのにも不可欠です。"
"Would you like to go for a walk in the park this afternoon?","今日の午後、公園に散歩に行きませんか？"
"The weather today is perfect for a picnic by the lake.","今日の天気は湖畔でのピクニックに最適です。"
